{
  "$schema": "https://json-schema.org/draft/2020-12/schema",
  "$id": "https://github.com/dreamabout/kaikei-envelope/schemas/v1/payment_prepaid.payload.schema.json",
  "title": "payment.prepaid payload (v1 mirror)",
  "description": "Mirrors validatePrepaidData() in Kaikei's PayloadValidator. Note: unlike order.shipped, the prepaid validator does NOT enforce the B2B customer fields -- only country_code + is_b2b are required on the customer.",
  "type": "object",
  "required": [
    "order_id",
    "customer",
    "gateway",
    "transaction_id",
    "prepaid_at",
    "items"
  ],
  "properties": {
    "order_id": {
      "type": "string",
      "minLength": 1
    },
    "customer": {
      "$ref": "#/$defs/customer"
    },
    "gateway": {
      "type": "string",
      "minLength": 1
    },
    "transaction_id": {
      "type": "string",
      "minLength": 1
    },
    "prepaid_at": {
      "type": "string",
      "format": "date-time"
    },
    "items": {
      "type": "array",
      "minItems": 1,
      "items": {
        "$ref": "#/$defs/item"
      }
    },
    "currency": {
      "type": "string",
      "pattern": "^[A-Z]{3}$"
    },
    "fx_rate_to_dkk": {
      "type": "string",
      "pattern": "^\\d+(\\.\\d+)?$"
    },
    "invoice_number": {
      "type": "string",
      "minLength": 1
    }
  },
  "$defs": {
    "decimal": {
      "type": "string",
      "pattern": "^-?\\d+(\\.\\d+)?$"
    },
    "customer": {
      "type": "object",
      "required": [
        "country_code",
        "is_b2b"
      ],
      "properties": {
        "country_code": {
          "type": "string"
        },
        "postal_code": {
          "type": "string",
          "pattern": "^[A-Za-z0-9][A-Za-z0-9 -]{0,11}$",
          "description": "DELIVERY postal code, from the same address as country_code. Determines the VAT territory: 78266 is Buesingen (outside the EU VAT area entirely), 6691 is Jungholz (19%, not Austria's 20%). A billing postal code paired with a delivery country is wrong in exactly the cases this exists to catch."
        },
        "is_b2b": {
          "type": "boolean"
        },
        "customer_id": {
          "type": "string"
        },
        "name": {
          "type": "string"
        },
        "email": {
          "type": "string"
        },
        "vat_number": {
          "type": "string"
        },
        "ean_number": {
          "type": "string",
          "pattern": "^\\d{13}$"
        },
        "address": {
          "type": "object",
          "properties": {
            "street": {
              "type": "string"
            },
            "city": {
              "type": "string"
            },
            "postal_code": {
              "type": "string"
            },
            "country": {
              "type": "string"
            }
          }
        }
      }
    },
    "item": {
      "type": "object",
      "required": [
        "type",
        "gross_amount",
        "vat_amount",
        "vat_rate"
      ],
      "properties": {
        "type": {
          "type": "string",
          "enum": [
            "physical",
            "gift_card",
            "digital"
          ]
        },
        "gross_amount": {
          "$ref": "#/$defs/decimal"
        },
        "vat_amount": {
          "$ref": "#/$defs/decimal"
        },
        "vat_rate": {
          "$ref": "#/$defs/decimal"
        }
      }
    }
  }
}
